,title,author,address,booktitle,note,year,volume,number,pages,pages,abstract,ISSN,ISBNs,doi,Funding Information,PDF Link,Author Keywords,IEEE Terms,keywords,series,series,series,note,note,note,note,publisher,ID
51,Conversation Clustering Adaptation for Intent Recognition,M. Lew; A. Obuchowski; E. Kacprzak; A. Pluwak,"SentiOne, Gdańsk, Poland; Gdańsk University of Technology, Gdańsk, Poland; SentiOne, Gdańsk, Poland; SentiOne, Gdańsk, Poland",2021 20th IEEE International Conference on Machine Learning and Applications (ICMLA),25 Jan 2022,2021,,,1278,1285,"With the increasing presence of NLU tools such as automatic dialogue systems, achieving high accuracy of intent recognition in chatbots becomes an especially important problem to tackle. This issue cannot be solved without sufficient training data, but the scarcity of labelled training data often poses a major challenge to the development of real-life chatbots. Therefore, methods utilizing unlabelled data resources have been recently gaining interest. One of most notable approaches is the use of pre-trained encoders based on language models. Trained for general purposes, they benefit from further domain adjustments. In our work we offer an approach that can increase the model’s accuracy for text classification, which can serve as an alternative for standard methods of domain adaptation. Our approach consists of a combination of methods: a clustering approach, similar to intent induction; an encoder domain adaptation on a cluster classification task, similar to intent recognition using unlabelled data; and model fine-tuning on labelled datasets. In this approach unlabelled data becomes complementary to labelled data, reducing the time needed for corpus building. We evaluate our approach on: 1) the public WebApp dataset and 2) a demanding real-life banking domain dataset, achieving 0.97 and 0.93 accuracy respectively. This approach, called Conversation Clustering Adaptation (CCA), when applied to an encoder, increases the accuracy of intent recognition up by to 12.4pp and exceeds current state-of-the-art methods while benefiting from the use of additional training data. We share our code at https://github.com/michal-lew/cca.",,978-1-6654-4337-1,10.1109/ICMLA52953.2021.00208,,https://ieeexplore.ieee.org/stamp/stamp.jsp?arnumber=9680255,natural language processing;domain adaptation;fine-tuning;knowledge-transfer;chat-bots,Adaptation models;Conferences;Transfer learning;Text categorization;Natural languages;Training data;Chatbots,,,,29.0,IEEE,25 Jan 2022,,,IEEE,IEEE Conferences
52,A Blockchain-Based Ticket Sales Platform,P. Sombat; P. Ratanaworachan,"Department of Computer Engineering, Faculty of Engineering, Kasetsart University, Bangkok, Thailand; Department of Computer Engineering, Faculty of Engineering, Kasetsart University, Bangkok, Thailand",2023 27th International Computer Science and Engineering Conference (ICSEC),4 Dec 2023,2023,,,226,230,"Concerts or fan meetings usually attract lots of attention, generating huge demand for tickets for these events. But, existing ticket purchase systems are unable to efficiently and transparently accommodate this. We often hear scandals of bot-controlled clients gobbling up tickets within seconds after sales open or celebrities acquiring prime tickets exceeding individual quota. These problems arise because existing systems are centralized. This can be a single point of failure and the controlling authority can ban or give privileges to certain users. This work sets out to remedy these problems using a blockchain-base solution that, by nature, is highly decentralized. We have created and deployed EVM (Ethereum Virtual Machine)-based smart contracts for ticket sales platform on two EVM-compatible blockchains, Ethereum (ETH) and Avalanche (AVAX). These contracts inherit heavily from the ERC-721 standard for NFT (Non-Fungible Token). The platforms on both blockchains engender the desirable transparency. However, the platform on Avalanche is much more efficient and economical to deploy and utilize. We have open-sourced the code for our platform on Github. Visit the following link to fork or check it out: https://github.com/JesperBerben/TicketNFT In addition, you can now interact with our platform on Avalanche which has been deployed and verified at the address linked to below: https://snowtrace.io/address/0x17fd3f6cf6cbff75604b63f1ca12c6db29730a9c",2768-0592,979-8-3503-4210-9,10.1109/ICSEC59635.2023.10329682,,https://ieeexplore.ieee.org/stamp/stamp.jsp?arnumber=10329682,Ticket sales platforms;Non-fungible tokens (NFTs);Avalanche blockchain;Ethereum blockchain,Computer science;Fans;Codes;Smart contracts;Standards organizations;Organizations;Censorship,,,,12.0,IEEE,4 Dec 2023,,,IEEE,IEEE Conferences
53,Explaining Differences in Classes of Discrete Sequences,S. Saadat; G. Sukthankar,"Department of Computer Science, University of Central Florida, Orlando, FL, US; Department of Computer Science, University of Central Florida, Orlando, FL, US",2020 IEEE/WIC/ACM International Joint Conference on Web Intelligence and Intelligent Agent Technology (WI-IAT),24 Jun 2021,2020,,,129,136,"While there are many machine learning methods to classify and cluster sequences, they fail to explain what are the differences in groups of sequences that make them distinguishable. Although in some cases having a black box model is sufficient, there is a need for increased explainability in research areas focused on human behaviors. For example, psychologists are less interested in having a model that predicts human behavior with high accuracy and more concerned with identifying differences between actions that lead to divergent human behavior. This paper presents techniques for understanding differences between classes of discrete sequences. Approaches introduced in this paper can be utilized to interpret black box machine learning models on sequences. The first approach compares k-gram representations of sequences using the silhouette score. The second method characterizes differences by analyzing the distance matrix of subsequences. As a case study, we trained black box supervised learning methods to classify sequences of GitHub teams and then utilized our sequence analysis techniques to measure and characterize differences between event sequences of teams with bots and teams without bots. In our second case study, we classified Minecraft event sequences to infer their high-level actions and analyzed differences between low-level event sequences of actions.",,978-1-6654-1924-6,10.1109/WIIAT50758.2020.00022,Defense Advanced Research Projects Agency; ,https://ieeexplore.ieee.org/stamp/stamp.jsp?arnumber=9457746,supervised learning;discrete sequence mining;explainable AI,Sequences;Supervised learning;Psychology;Machine learning;Predictive models;Observers;Teamwork,,2.0,,27.0,IEEE,24 Jun 2021,,,IEEE,IEEE Conferences
54,Improved text language identification for the South African languages,B. Duvenhage; M. Ntini; P. Ramonyai,"Praekelt Consulting, Feersum Engine, Johannesburg, South Africa; Engineering Team, Praekelt Consulting, Johannesburg, South Africa; Engineering Team, Praekelt Consulting, Johannesburg, South Africa",2017 Pattern Recognition Association of South Africa and Robotics and Mechatronics (PRASA-RobMech),18 Jan 2018,2017,,,214,218,"Virtual assistants and text chatbots have recently been gaining popularity. Given the short message nature of text-based chat interactions, the language identification systems of these bots might only have 15 or 20 characters to make a prediction. However, accurate text language identification is important, especially in the early stages of many multilingual natural language processing pipelines. This paper investigates the use of a naive Bayes classifier, to accurately predict the language family that a piece of text belongs to, combined with a lexicon based classifier to distinguish the specific South African language that the text is written in. This approach leads to a 31% reduction in the language detection error. In the spirit of reproducible research the training and testing datasets as well as the code are published on github. Hopefully it will be useful to create a text language identification shared task for South African languages.",,978-1-5386-2314-5,10.1109/RoboMech.2017.8261150,,https://ieeexplore.ieee.org/stamp/stamp.jsp?arnumber=8261150,Naive Bayesian text classification;lexicon based text classification;text language identification,Training;Google;Natural language processing;Testing;Support vector machines;Pipelines,,5.0,,12.0,IEEE,18 Jan 2018,,,IEEE,IEEE Conferences
55,Dish-ID: A neural-based method for ingredient extraction and further recipe suggestion,I. Shchuka; S. Miftakhov; V. Patrushev; M. Tikhonova; A. Fenogenova,"MPEI (Moscow Power Engineering Institute), Moscow, Russia; New Economic School (NES), Moscow, Russia; NSU (Novosibirsk State University), Novosibirsk, Russia; National Research University Higher School of Economics, Sberbank, Moscow, Russia; Sberbank, Moscow, Russia",2020 International Conference Engineering and Telecommunication (En&T),24 May 2021,2020,,,1,5,"The paper presents a method for meal recognition, ingredient extraction and recipe suggestion in the Russian language. The proposed algorithm consists of several consecutive stages. On the first stage the model extracts a list of ingredients from a photo of the dish, based on which recipes on the second stage are selected. Two ingredient extraction architectures were tested for the first stage and three recipe matching methods for recipe suggestion are proposed. In addition, the algorithm was incorporated into the telegram-bot which provides friendly user experience. Source code is at https://github.com/Alenushldish_id_sirius.",,978-1-7281-8829-4,10.1109/EnT50437.2020.9431242,,https://ieeexplore.ieee.org/stamp/stamp.jsp?arnumber=9431242,machine learning;natural language processing;computer vision;deep learning;neural networks;food recognition;food detection;image capturing;ingredient extraction,Adaptation models;Machine learning algorithms;Pipelines;Europe;User experience;Task analysis,,1.0,,14.0,IEEE,24 May 2021,,,IEEE,IEEE Conferences
56,Toward an Empirical Theory of Feedback-Driven Development,M. Beller,,2018 IEEE/ACM 40th International Conference on Software Engineering: Companion (ICSE-Companion),30 Aug 2018,2018,,,503,505,"Software developers today crave for feedback, be it from their peers or even bots in the form of code review, static analysis tools like their compiler, or the local or remote execution of their tests in the Continuous Integration (CI) environment. With the advent of social coding sites like GitHub and tight integration of CI services like Travis CI, software development practices have fundamentally changed. Despite a highly changed software engineering landscape, however, we still lack a suitable description of an individual's contemporary software development practices, that is how an individual code contribution comes to be. Existing descriptions like the v-model are either too coarse-grained to describe an individual contributor's workflow, or only regard a sub-part of the development process like Test-Driven Development. In addition, most existing models are prerather than de-scriptive. By contrast, in our thesis, we perform a series of empirical studies to describe the individual constituents of Feedback-Driven Development (FDD) and then compile the evidence into an initial theory on how modern software development works. Our thesis culminates in the finding that feedback loops are the characterizing criterion of contemporary software development. Our model is flexible enough to accommodate a broad bandwidth of contemporary workflows, despite large variances in how projects use and configure parts of FDD.",2574-1934,978-1-4503-5663-3,,,https://ieeexplore.ieee.org/stamp/stamp.jsp?arnumber=8449638,Feedback-Driven Development (FDD),Software;Testing;Software engineering;Static analysis;Tools;Quality assurance;Debugging,,,,,,30 Aug 2018,,,IEEE,IEEE Conferences
57,Multi-Domain Learning and Identity Mining for Vehicle Re-Identification,S. He; H. Luo; W. Chen; M. Zhang; Y. Zhang; F. Wang; H. Li; W. Jiang,Zhejiang University; Zhejiang University; Alibaba Group; Zhejiang University; Alibaba Group; Alibaba Group; Alibaba Group; Zhejiang University,2020 IEEE/CVF Conference on Computer Vision and Pattern Recognition Workshops (CVPRW),28 Jul 2020,2020,,,2485,2493,"This paper introduces our solution for the Track2 in AI City Challenge 2020 (AICITY20). The Track2 is a vehicle re-identification (ReID) task with both the real-world data and synthetic data.Our solution is based on a strong baseline with bag of tricks (BoT-BS) proposed in person ReID. At first, we propose a multi-domain learning method to joint the real-world and synthetic data to train the model. Then, we propose the Identity Mining method to automatically generate pseudo labels for a part of the testing data, which is better than the k-means clustering. The tracklet-level re-ranking strategy with weighted features is also used to post-process the results. Finally, with multiple-model ensemble, our method achieves 0.7322 in the mAP score which yields third place in the competition. The codes are available at https://github.com/heshuting555/AICITY2020_DMT_VehicleReID.",2160-7516,978-1-7281-9360-1,10.1109/CVPRW50498.2020.00299,,https://ieeexplore.ieee.org/stamp/stamp.jsp?arnumber=9150926,,Data models;Task analysis;Testing;Feature extraction;Urban areas;Data mining;Computer vision,,41.0,,32.0,IEEE,28 Jul 2020,,,IEEE,IEEE Conferences
58,On the Use of Dependabot Security Pull Requests,M. Alfadel; D. E. Costa; E. Shihab; M. Mkhallalati,"Data-driven Analysis of Software (DAS) Lab, Concordia University, Montreal, Canada; Data-driven Analysis of Software (DAS) Lab, Concordia University, Montreal, Canada; Data-driven Analysis of Software (DAS) Lab, Concordia University, Montreal, Canada; Data-driven Analysis of Software (DAS) Lab, Concordia University, Montreal, Canada",2021 IEEE/ACM 18th International Conference on Mining Software Repositories (MSR),28 Jun 2021,2021,,,254,265,"Vulnerable dependencies are a major problem in modern software development. As software projects depend on multiple external dependencies, developers struggle to constantly track and check for corresponding security vulnerabilities that affect their project dependencies. To help mitigate this issue, Dependabot has been created, a bot that issues pull-requests to automatically update vulnerable dependencies. However, little is known about the degree to which developers adopt Dependabot to help them update vulnerable dependencies.In this paper, we investigate 2,904 JavaScript open-source GitHub projects that subscribed to Dependabot. Our results show that the vast majority (65.42%) of the created security-related pull-requests are accepted, often merged within a day. Through manual analysis, we identify 7 main reasons for Dependabot security pull-requests not being merged, mostly related to concurrent modifications of the affected dependencies rather than Dependabot failures. Interestingly, only 3.2% of the manually examined pull-requests suffered from build breakages. Finally, we model the time it takes to merge a Dependabot security pull-request using characteristics from projects, the fixed vulnerabilities and issued pull requests. Our model reveals 5 significant features to explain merge times, e.g., projects with relevant experience with Dependabot security pull-requests are most likely associated with rapid merges. Surprisingly, the severity of the dependency vulnerability and the potential risk of breaking changes are not strongly associated with the merge time. To the best of our knowledge, this study is the first to evaluate how developers receive Dependabot’s security contributions. Our findings indicate that Dependabot provides an effective platform for increasing awareness of dependency vulnerabilities and helps developers mitigate vulnerability threats in JavaScript projects.",2574-3864,978-1-7281-8710-5,10.1109/MSR52588.2021.00037,,https://ieeexplore.ieee.org/stamp/stamp.jsp?arnumber=9463148,Dependabot;pull request;dependency;security vulnerability,Manuals;Security;Data mining;Open source software;Software development management,,19.0,,74.0,IEEE,28 Jun 2021,,,IEEE,IEEE Conferences
59,"Mitigating Turnover with Code Review Recommendation: Balancing Expertise, Workload, and Knowledge Distribution",E. Mirsaeedi; P. C. Rigby,"Department of Computer Science and Software Engineering, Concordia University, Montréal, Québec, Canada; Department of Computer Science and Software Engineering, Concordia University, Montréal, Québec, Canada",2020 IEEE/ACM 42nd International Conference on Software Engineering (ICSE),21 Dec 2020,2020,,,1183,1195,"Developer turnover is inevitable on software projects and leads to knowledge loss, a reduction in productivity, and an increase in defects. Mitigation strategies to deal with turnover tend to disrupt and increase workloads for developers. In this work, we suggest that through code review recommendation we can distribute knowledge and mitigate turnover with minimal impact on the development process. We evaluate review recommenders in the context of ensuring expertise during review, Expertise, reducing the review workload of the core team, CoreWorkload, and reducing the Files at Risk to turnover, FaR. We find that prior work that assigns reviewers based on file ownership concentrates knowledge on a small group of core developers increasing risk of knowledge loss from turnover by up to 65%. We propose learning and retention aware review recommenders that when combined are effective at reducing the risk of turnover by -29% but they unacceptably reduce the overall expertise during reviews by -26%. We develop the Sofia recommender that suggests experts when none of the files under review are hoarded by developers, but distributes knowledge when files are at risk. In this way, we are able to simultaneously increase expertise during review with a ΔExpertise of 6%, with a negligible impact on workload of ΔCoreWorkload of 0.09%, and reduce the files at risk by ΔFaR -28%. Sofia is integrated into GitHub pull requests allowing developers to select an appropriate expert or “learner” based on the context of the review. We release the Sofia bot as well as the code and data for replication purposes.",1558-1225,978-1-4503-7121-6,10.1145/3377811.3380335,,https://ieeexplore.ieee.org/stamp/stamp.jsp?arnumber=9284120,Turnover;Knowledge Distribution;Code Review;Recommenders;Tool Support,Productivity;Knowledge engineering;Software;Software engineering;Software development management,,18.0,,56.0,,21 Dec 2020,,,IEEE,IEEE Conferences
60,Robust Text CAPTCHAs Using Adversarial Examples,R. Shao; Z. Shi; J. Yi; P. -Y. Chen; C. -J. Hsieh,"Machine Learning Department, Carnegie Mellon University, Pittsburgh, United States; Computer Science Department, University of California, Los Angeles, Los Angeles, United States; JD AI Research, Jd.Com, Inc., Shanghai, China; IBM Research, IBM, New York, United States; Computer Science Department, University of California, Los Angeles, Los Angeles, United States",2022 IEEE International Conference on Big Data (Big Data),26 Jan 2023,2022,,,1495,1504,"CAPTCHA (Completely Automated Public Turing test to tell Computers and Humans Apart) is a widely used technology to distinguish real users and automated users such as bots. However, the advance of AI technologies weakens many CAPTCHA tests and can induce security concerns. In this paper, we propose a user-friendly text-based CAPTCHA generation method named Robust Text CAPTCHA (RTC). At the first stage, the foregrounds and backgrounds are constructed with font and background images respectively sampled from font and image libraries, and they are then synthesized into identifiable pseudo adversarial CAPTCHAs. At the second stage, we utilize a highly transferable adversarial attack designed for text CAPTCHAs to better obstruct CAPTCHA solvers. Our experiments cover comprehensive models including shallow models such as KNN, SVM and random forest, as well as various deep neural networks and OCR models. Experiments show that our CAPTCHAs have a failure rate lower than one millionth in general and high usability. They are also robust against various defensive techniques that attackers may employ, including adversarially trained CAPTCHA solvers and solvers trained with collected RTCs using manual annotation. Codes available at https://github.com/RulinShao/RTC.",,978-1-6654-8045-1,10.1109/BigData55660.2022.10021100,,https://ieeexplore.ieee.org/stamp/stamp.jsp?arnumber=10021100,CAPTCHAs;adversarial example applications;security,Training;Deep learning;Support vector machines;Ultraviolet sources;Optical character recognition;Neural networks;Manuals,,4.0,,35.0,IEEE,26 Jan 2023,,,IEEE,IEEE Conferences
61,BreakBot: Analyzing the Impact of Breaking Changes to Assist Library Evolution,L. Ochoa; T. Degueule; J. -R. Falleri,"Eindhoven University of Technology; Univ. Bordeaux, Bordeaux INP, CNRS, LaBRI, UMR5800, Talence, France; Univ. Bordeaux, Bordeaux INP, CNRS, LaBRI, UMR5800, Institut Universitaire de France, Talence, France",2022 IEEE/ACM 44th International Conference on Software Engineering: New Ideas and Emerging Results (ICSE-NIER),13 Jun 2022,2022,,,26,30,"“If we make this change to our code, how will it impact our clients?” It is difficult for library maintainers to answer this simple—yet essential!—question when evolving their libraries. Library maintainers are constantly balancing between two opposing positions: make changes at the risk of breaking some of their clients, or avoid changes and maintain compatibility at the cost of immobility and growing technical debt. We argue that the lack of objective usage data and tool support leaves maintainers with their own subjective perception of their community to make these decisions.We introduce BreakBot, a bot that analyses the pull requests of Java libraries on GitHub to identify the breaking changes they introduce and their impact on client projects. Through static analysis of libraries and clients, it extracts and summarizes objective data that enrich the code review process by providing maintainers with the appropriate information to decide whether—and how—changes should be accepted, directly in the pull requests.",,978-1-6654-9596-7,10.1145/3510455.3512783,,https://ieeexplore.ieee.org/stamp/stamp.jsp?arnumber=9793524,software libraries;software evolution;breaking changes;breakbot,Java;Codes;Costs;Static analysis;Chatbots;Libraries;Object recognition;Data mining;Software engineering;Software development management,,2.0,,32.0,IEEE,13 Jun 2022,,,IEEE,IEEE Conferences
62,"GeeSolver: A Generic, Efficient, and Effortless Solver with Self-Supervised Learning for Breaking Text Captchas",R. Zhao; X. Deng; Y. Wang; Z. Yan; Z. Han; L. Chen; Z. Xue; Y. Wang,"Shanghai Jiao Tong University; Shanghai Jiao Tong University; QI-ANXIN; Shanghai Jiao Tong University; QI-AN Pangu (Shanghai) InfoTech Co., Ltd.; Shanghai Jiao Tong University; Shanghai Jiao Tong University; Shanghai Jiao Tong University",2023 IEEE Symposium on Security and Privacy (SP),21 Jul 2023,2023,,,1649,1666,"Although text-based captcha, which is used to differentiate between human users and bots, has faced many attack methods, it remains a widely used security mechanism and is employed by some websites. Some deep learning-based text captcha solvers have shown excellent results, but the labor-intensive and time-consuming labeling process severely limits their viability. Previous works attempted to create easy-to-use solvers using a limited collection of labeled data. However, they are hampered by inefficient preprocessing procedures and inability to recognize the captchas with complicated security features.In this paper, we propose GeeSolver, a generic, efficient, and effortless solver for breaking text-based captchas based on self-supervised learning. Our insight is that numerous difficult-to-attack captcha schemes that ""damage"" the standard font of characters are similar to image masks. And we could leverage masked autoencoders (MAE) to improve the captcha solver to learn the latent representation from the ""unmasked"" part of the captcha images. Specifically, our model consists of a ViT encoder as latent representation extractor and a well-designed decoder for captcha recognition. We apply MAE paradigm to train our encoder, which enables the encoder to extract latent representation from local information (i.e., without masking part) that can infer the corresponding character. Further, we freeze the parameters of the encoder and leverage a few labeled captchas and many unlabeled captchas to train our captcha decoder with semi-supervised learning.Our experiments with real-world captcha schemes demonstrate that GeeSolver outperforms the state-of-the-art methods by a large margin using a few labeled captchas. We also show that GeeSolver is highly efficient as it can solve a captcha within 25 ms using a desktop CPU and 9 ms using a desktop GPU. Besides, thanks to latent representation extraction, we successfully break the hard-to-attack captcha schemes, proving the generality of our solver. We hope that our work will help security experts to revisit the design and availability of text-based captchas. The code is available at https://github.com/NSSL-SJTU/GeeSolver.",2375-1207,978-1-6654-9336-9,10.1109/SP46215.2023.10179379,,https://ieeexplore.ieee.org/stamp/stamp.jsp?arnumber=10179379,Text-based-captchas;deep-learning;self-supervised-learning;masked-autoencoders,Privacy;Self-supervised learning;Feature extraction;Real-time systems;Decoding;Security;Data mining,,2.0,,44.0,IEEE,21 Jul 2023,,,IEEE,IEEE Conferences
